{
  "schema_version": "0.1.0",
  "trace_id": "67a58ac9f2c648bcfca4104ddf6d16b6",
  "tenant_id": "cuad-public",
  "project_id": "cuad-contract-review",
  "started_at": "2021-03-11T12:00:00Z",
  "ended_at": "2021-03-11T12:00:00.009000Z",
  "status": "ok",
  "source": {
    "provider": "opentelemetry",
    "native_trace_id": "67a58ac9f2c648bcfca4104ddf6d16b6",
    "adapter_name": "ragproof-otel-python",
    "adapter_version": "0.1.0"
  },
  "pipeline": {
    "fingerprint": "2517657377bf6d5a1c7e57886746d687db163b4cbd7a4f172c16344988d5970d",
    "parser": {
      "name": "cuad-text",
      "version": "healthy",
      "config_hash": "eac74bcf0376dbce9954f07b6f090c9976b417dae0711824070fe38b158dd156"
    },
    "chunker": {
      "name": "character-window",
      "version": "healthy",
      "config_hash": "c8e8a067a6ed025c6d8fade918a72afbccd2351fc98a62049c3071ea1e3a20a8"
    },
    "embedder": {
      "name": "hashed-64",
      "version": "v1",
      "config_hash": "971d391dd3285a2ee586171f537d6635ffbf5f8a05a3e277cf203740d9aa0f31"
    },
    "retriever": {
      "name": "hybrid",
      "version": "healthy",
      "config_hash": "b2609432138257edf0d13eb38e1121187c861bbfaf73cd3871b1a4bd366c5eb7"
    },
    "reranker": {
      "name": "policy",
      "version": "healthy",
      "config_hash": "7a4b95872aa88372e479b0c1151c88c2d418524968a07f60c2f2ae55e21f3744"
    },
    "prompt": {
      "name": "cuad-clause-extraction",
      "version": "v1",
      "config_hash": "3fe6f006a4c7062efd38a48ad0801fae741bd8ca6287f3b7e70559a74bedde81"
    },
    "generator": {
      "name": "deterministic-extractive",
      "version": "corrupt_annotated_value",
      "config_hash": "fc3ab64e65a162d7a4bfec78d2278a3b42143ce5c397e9bd8190dae741a7d3ea"
    },
    "citation": {
      "name": "citation-linker",
      "version": "healthy",
      "config_hash": "3a353d13b82aff80d43ea76f312a4e0712a3e1ccc657ed0d6476aed0c54bdb98"
    }
  },
  "knowledge_base": {
    "data_source_id": "cuad-v1",
    "corpus_version": "cuad-v1:current",
    "index_version": "in-memory-hybrid:v1"
  },
  "query": {
    "content_hash": "4fc0414f6243ad7e13b0ecd3155e86839be3d3edd6206c90381f605dc4e41dbd",
    "content": "Highlight the parts (if any) of this contract related to \"Notice Period To Terminate Renewal\" that should be reviewed by a lawyer. Details: What is the notice period required to terminate renewal?"
  },
  "retrieval": {
    "top_k": 6,
    "candidates": [
      {
        "chunk_id": "cuad-contract-2e55ecc57f22:cuad-v1:f8161d18bea4:block:0:chunk:28",
        "document_id": "cuad-contract-2e55ecc57f22",
        "document_version": "cuad-v1:f8161d18bea4",
        "content_hash": "ce454ec7b63bc6cc8b17fc841552cca8f131ce5a46e45c9d44309522a72aea02",
        "retrieval_rank": 1,
        "retrieval_score": 0.461458,
        "rerank_rank": 2,
        "rerank_score": 0.461458,
        "included_in_context": false,
        "content": " the agreement; (c) purchase orders; and (d) drawings and specifications. in the event of an irreconcilable conflict, discrepancy, error, or omission, the provision imposing the greater duty on subcontractor shall apply. materials or work described in words that have a well-known technical or trade meaning shall be held to refer to such recognized standards. 31. severability if any provision of this agreement is illegal or unenforceable, its invalidity shall not affect the other provision of this agreement that can be given effect without the invalid provision. if any provision of this agreement does not comply with any law, ordinance or regulation, such provision to the extent possible shall be interpreted in such a manner to comply with such law, ordinance or regulation, or if such interpretation is not possible, it shall be deemed to satisfy the minimum requirements thereof. all provisions required by law shall be deemed incorporated herein by reference. strategic alliance agreement \"edge-fte\" page 12 32. amendment this agreement may be amended or modified only by a written instrument executed by both edge and subcontractor. 33. right of replacement edge may, upon reasonable request, require subcontractor to replace any personnel, including a project manager, deployed by subcontractor under the terms of this agreement. subcontractor will replace any personnel promptly after "
      },
      {
        "chunk_id": "cuad-contract-99dea8d7575f:cuad-v1:f8161d18bea4:block:0:chunk:8",
        "document_id": "cuad-contract-99dea8d7575f",
        "document_version": "cuad-v1:f8161d18bea4",
        "content_hash": "b9a54335d30d3bc19f6433c14417f39a00e616df631ad77ac1ff4839c50cd74e",
        "retrieval_rank": 2,
        "retrieval_score": 0.454042,
        "rerank_rank": 1,
        "rerank_score": 1.454042,
        "included_in_context": true,
        "content": "titute a criminal offense, give rise to civil liability, or otherwise violate any local, state, national, or international law. the customer expressly agrees to use all of i-on's services only for lawful purposes. transmission or storage of any information, data, or material in violation of united states or state regulation or law is prohibited, including but not limited to, material protected by copyright, trademark, trade secret, or any other statute. term and termination the term of this agreement for the hosted site shall commence upon april 1, 1999 and shall continue for a period of six (6) months, unless earlier terminated in accordance with provisions hereof. this agreement shall automatically be renewed for one (1) or more one (1) month periods unless either the customer or i-on gives notice to the other party of its intention not to renew the 4 agreement, which notice must be given not less than fifteen (15) days before the end of the respective initial or renewal term. either party may terminate this agreement without cause at any time effective upon thirty (30) days' written notice. notwithstanding anything to the contrary contained in this agreement, no termination of this agreement for any reason whatsoever shall relieve the customer of the obligation to pay all amounts due to i-on and to make such payments on a timely basis. limitation of liability i-on will not b"
      },
      {
        "chunk_id": "cuad-contract-2e55ecc57f22:cuad-v1:f8161d18bea4:block:0:chunk:1",
        "document_id": "cuad-contract-2e55ecc57f22",
        "document_version": "cuad-v1:f8161d18bea4",
        "content_hash": "0bfa8dcb754f981352a1fb62830b804ebb1f7a4176a4b793aec259bb128e9869",
        "retrieval_rank": 3,
        "retrieval_score": 0.451778,
        "rerank_rank": 3,
        "rerank_score": 0.451778,
        "included_in_context": false,
        "content": "erform its scope of work, in accordance with the terms and conditions of this in accordance with the terms and conditions of the respective issued purchase order(s). the work, as defined below, is a portion of the services to be provided by for a communications service provider mediacom, llc (the \"customer\"). 1. terms a. this agreement shall remain in effect for the duration of the initial term, unless earlier terminated pursuant to the provision entitled \"termination of agreement\". after the initial term, this agreement shall continue on a month to month basis until terminated by either party upon thirty (30) days prior written notice to the other setting forth the effective date of such termination. the termination of any purchase order shall not affect the obligations of either party to the other party pursuant to any other purchase order or to this agreement. the termination of this agreement shall terminate the obligations of either party to the other party pursuant to any purchase order and those obligations pursuant to this agreement, except as to obligations that are identified herein or in a terminated purchase order as surviving termination. b. should the agreement expire during the period of performance, all remaining work of each purchase order will be completed under the terms of the agreement then in effect on the date of award for each respective purchase order, "
      },
      {
        "chunk_id": "cuad-contract-2e55ecc57f22:cuad-v1:f8161d18bea4:block:0:chunk:16",
        "document_id": "cuad-contract-2e55ecc57f22",
        "document_version": "cuad-v1:f8161d18bea4",
        "content_hash": "fff54306037630dc24dcaebd1c6ac554cbfac283efe430d4399adf2e2e60bab6",
        "retrieval_rank": 4,
        "retrieval_score": 0.444618,
        "rerank_rank": 4,
        "rerank_score": 0.444618,
        "included_in_context": false,
        "content": "plicable law in connection with subcontractor's performance of work hereunder. subcontractor represents and warrants to edge that subcontractor's performance of this agreement will not violate any other employment, services, confidentiality, consulting or other agreement to which subcontractor is a party or by which it may be bound. 17. warranty a. subcontractor warrants to edge that the work will be performed with promptness and diligence and shall be executed in a quality manner consistent with workmanship standards in the particular trades involved. b. edge may accept any nonconforming work instead of requiring its removal and correction upon the condition that subcontractor shall pay edge an appropriate amount for damages and compensation as is mutually agreed upon by edge and subcontractor. warranty is not waived under such conditions. c. if within one (1) year from the date of completion of work acceptance, or within one (1) year from the completion of all other work or services and acceptance by edge (or within any longer materials warranty period as set forth above), any defects exists or arise, then in each case upon receipt of notice of such defect, subcontractor shall (unless edge chooses another remedy) promptly cause such defect(s) to be repaired or remedied at subcontractor's sole cost and expense, including but not limited to the costs of transportation, uncoveri"